{
  "$schema": "http://json-schema.org/draft-07/schema#",
  "additionalProperties": true,
  "properties": {
    "assurance": {
      "additionalProperties": true,
      "properties": {
        "assuranceProfileRef": {
          "description": "Reference to the governing server-side AssuranceProfile, when one exists.",
          "maxLength": 256,
          "minLength": 1,
          "type": "string"
        },
        "summary": {
          "description": "Engineering assurance requirement statement, e.g. `room dimensions to ±20mm at 95%`. Fixed by the task; never lowered because of device limitations.",
          "maxLength": 4096,
          "minLength": 1,
          "type": "string"
        }
      },
      "required": [
        "summary"
      ],
      "type": "object"
    },
    "contractVersion": {
      "description": "Strict semver contract version carried by every wire object. Decoders accept the same major version; any other version is a typed error.",
      "pattern": "^(0|[1-9]\\d*)\\.(0|[1-9]\\d*)\\.(0|[1-9]\\d*)(?:-[0-9A-Za-z-]+(?:\\.[0-9A-Za-z-]+)*)?(?:\\+[0-9A-Za-z-]+(?:\\.[0-9A-Za-z-]+)*)?$",
      "type": "string"
    },
    "createdAt": {
      "description": "ISO 8601 UTC timestamp with millisecond precision, `Z` suffix only.",
      "pattern": "^\\d{4}-\\d{2}-\\d{2}T\\d{2}:\\d{2}:\\d{2}\\.\\d{3}Z$",
      "type": "string"
    },
    "intent": {
      "description": "Engineering intent the mission serves.",
      "maxLength": 4096,
      "minLength": 1,
      "type": "string"
    },
    "missionId": {
      "description": "Opaque stable identifier assigned by the authority that owns the object.",
      "maxLength": 256,
      "minLength": 1,
      "type": "string"
    },
    "referenceControls": {
      "items": {
        "additionalProperties": true,
        "properties": {
          "contractVersion": {
            "description": "Strict semver contract version carried by every wire object. Decoders accept the same major version; any other version is a typed error.",
            "pattern": "^(0|[1-9]\\d*)\\.(0|[1-9]\\d*)\\.(0|[1-9]\\d*)(?:-[0-9A-Za-z-]+(?:\\.[0-9A-Za-z-]+)*)?(?:\\+[0-9A-Za-z-]+(?:\\.[0-9A-Za-z-]+)*)?$",
            "type": "string"
          },
          "controlId": {
            "description": "Opaque stable identifier assigned by the authority that owns the object.",
            "maxLength": 256,
            "minLength": 1,
            "type": "string"
          },
          "description": {
            "maxLength": 4096,
            "minLength": 1,
            "type": "string"
          },
          "kind": {
            "description": "Open vocabulary for the reference object type, e.g. `scale_bar`, `checkerboard`, `marker`.",
            "maxLength": 256,
            "minLength": 1,
            "type": "string"
          },
          "knownDimensions": {
            "description": "Certified/known dimensions providing metric ground truth.",
            "items": {
              "additionalProperties": true,
              "properties": {
                "label": {
                  "description": "Dimension label, e.g. `length`, `diagonal`.",
                  "maxLength": 256,
                  "minLength": 1,
                  "type": "string"
                },
                "uncertainty": {
                  "additionalProperties": true,
                  "properties": {
                    "kind": {
                      "enum": [
                        "DIMENSIONAL",
                        "STATISTICAL",
                        "INTERVAL"
                      ],
                      "type": "string"
                    },
                    "level": {
                      "maxLength": 256,
                      "minLength": 1,
                      "type": "string"
                    },
                    "lower": {
                      "type": "number"
                    },
                    "plusMinus": {
                      "type": "number"
                    },
                    "upper": {
                      "type": "number"
                    }
                  },
                  "required": [
                    "kind"
                  ],
                  "type": "object"
                },
                "unit": {
                  "maxLength": 256,
                  "minLength": 1,
                  "type": "string"
                },
                "value": {
                  "type": "number"
                }
              },
              "required": [
                "label",
                "value",
                "unit"
              ],
              "type": "object"
            },
            "type": "array"
          }
        },
        "required": [
          "contractVersion",
          "controlId",
          "kind",
          "knownDimensions"
        ],
        "type": "object"
      },
      "type": "array"
    },
    "requiredEvidence": {
      "items": {
        "additionalProperties": true,
        "properties": {
          "description": {
            "description": "What evidence is required and why.",
            "maxLength": 4096,
            "minLength": 1,
            "type": "string"
          },
          "fallbackMethods": {
            "description": "Ordered acceptable substitution chain (strongest first). Empty = no substitution accepted. Each accepted alternative retains its own method/uncertainty semantics.",
            "items": {
              "enum": [
                "DEPTH_SENSING",
                "VISUAL_RECONSTRUCTION",
                "CALIBRATED_REFERENCE",
                "MANUAL_MEASUREMENT",
                "SPECIALIST_INSTRUMENT",
                "VIDEO_FOOTAGE",
                "STILL_IMAGERY",
                "INSTRUMENT_READING",
                "HUMAN_ANSWER",
                "DOCUMENT_REGION",
                "VOICE_NOTE"
              ],
              "type": "string"
            },
            "type": "array"
          },
          "preferredMethod": {
            "enum": [
              "DEPTH_SENSING",
              "VISUAL_RECONSTRUCTION",
              "CALIBRATED_REFERENCE",
              "MANUAL_MEASUREMENT",
              "SPECIALIST_INSTRUMENT",
              "VIDEO_FOOTAGE",
              "STILL_IMAGERY",
              "INSTRUMENT_READING",
              "HUMAN_ANSWER",
              "DOCUMENT_REGION",
              "VOICE_NOTE"
            ],
            "type": "string"
          },
          "requirementId": {
            "description": "Opaque stable identifier assigned by the authority that owns the object.",
            "maxLength": 256,
            "minLength": 1,
            "type": "string"
          }
        },
        "required": [
          "requirementId",
          "description",
          "preferredMethod",
          "fallbackMethods"
        ],
        "type": "object"
      },
      "type": "array"
    },
    "revision": {
      "description": "Monotonic revision counter; state transitions append new revisions.",
      "minimum": 0,
      "type": "integer"
    },
    "state": {
      "enum": [
        "draft",
        "active",
        "completed",
        "escalated",
        "abandoned"
      ],
      "type": "string"
    },
    "steps": {
      "items": {
        "additionalProperties": true,
        "properties": {
          "contractVersion": {
            "description": "Strict semver contract version carried by every wire object. Decoders accept the same major version; any other version is a typed error.",
            "pattern": "^(0|[1-9]\\d*)\\.(0|[1-9]\\d*)\\.(0|[1-9]\\d*)(?:-[0-9A-Za-z-]+(?:\\.[0-9A-Za-z-]+)*)?(?:\\+[0-9A-Za-z-]+(?:\\.[0-9A-Za-z-]+)*)?$",
            "type": "string"
          },
          "instructions": {
            "description": "Operator guidance (coverage, angles, prompts).",
            "maxLength": 4096,
            "minLength": 1,
            "type": "string"
          },
          "mandatory": {
            "type": "boolean"
          },
          "method": {
            "enum": [
              "DEPTH_SENSING",
              "VISUAL_RECONSTRUCTION",
              "CALIBRATED_REFERENCE",
              "MANUAL_MEASUREMENT",
              "SPECIALIST_INSTRUMENT",
              "VIDEO_FOOTAGE",
              "STILL_IMAGERY",
              "INSTRUMENT_READING",
              "HUMAN_ANSWER",
              "DOCUMENT_REGION",
              "VOICE_NOTE"
            ],
            "type": "string"
          },
          "requirementRefs": {
            "description": "Evidence requirements this step serves (may be empty).",
            "items": {
              "description": "Opaque stable identifier assigned by the authority that owns the object.",
              "maxLength": 256,
              "minLength": 1,
              "type": "string"
            },
            "type": "array"
          },
          "sequence": {
            "description": "Execution order within the mission; unique and ascending.",
            "minimum": 0,
            "type": "integer"
          },
          "stepId": {
            "description": "Opaque stable identifier assigned by the authority that owns the object.",
            "maxLength": 256,
            "minLength": 1,
            "type": "string"
          },
          "title": {
            "maxLength": 256,
            "minLength": 1,
            "type": "string"
          }
        },
        "required": [
          "contractVersion",
          "stepId",
          "sequence",
          "title",
          "instructions",
          "method",
          "requirementRefs",
          "mandatory"
        ],
        "type": "object"
      },
      "type": "array"
    },
    "updatedAt": {
      "description": "ISO 8601 UTC timestamp with millisecond precision, `Z` suffix only.",
      "pattern": "^\\d{4}-\\d{2}-\\d{2}T\\d{2}:\\d{2}:\\d{2}\\.\\d{3}Z$",
      "type": "string"
    }
  },
  "required": [
    "contractVersion",
    "missionId",
    "state",
    "intent",
    "assurance",
    "requiredEvidence",
    "steps",
    "referenceControls",
    "revision",
    "createdAt",
    "updatedAt"
  ],
  "type": "object"
}
